PMID,Author,Title,Journal,Year,Abstract,DOI
39275850,"['Dziedzic, Arkadiusz', 'Issa, Julien', 'Chaurasia, Akhilanand', 'Tanasiewicz, Marta']",Artificial intelligence and health-related data: The patient's best interest and data ownership dilemma.,"Proceedings of the Institution of Mechanical Engineers. Part H, Journal of engineering in medicine",2024 Sep 14,"The rapid advancement of artificial intelligence (AI) in healthcare has the potential to revolutionize the global healthcare sector and medicine in general. However, integrating AI technologies in healthcare requires access to large amounts of personal health-related data (HRD), which raises concerns regarding confidential personal information considering unregulated and not transparent data ownership. Setting up the patient's welfare as an unquestionable principle, this commentary explores the various ethical aspects of using HRD in AI applications, focusing on informed consent, data ownership, data sharing, financial considerations, accountability, and ethical standards. Three models of potential collaboration between AI-specializing firms and healthcare providers are evaluated: the commercial model, the equitable profit-sharing model, and the public-funded non-profit model. Each model has its advantages and challenges, necessitating a careful balance between ethical considerations, financial implications, and technological advancements. Policymakers and healthcare regulators are urged to establish transparent legislation to safeguard patient privacy, ensure informed consent, and promote the responsible use of HRD in AI applications. This commentary emphasizes the importance of addressing ethical issues to protect basic patient rights, foster responsible collaborations, and ensure the ethical use of health-related data in AI-based healthcare applications. While the coexistence of regulated AI and healthcare professionals is inevitable for validating the cost-effectiveness of AI use in healthcare economics, the transparency of HRD sources is deemed of utmost importance in the best interest of the patient.",https://doi.org/10.1177/09544119241279630
39274428,"['Schwarzmaier, Julia', 'Frenkel, Elisabeth', 'Neumayr, Julia', 'Ammar, Nour', 'Kessler, Andreas', 'Schwendicke, Falk', 'Kühnisch, Jan', 'Dujic, Helena']",Validation of an Artificial Intelligence-Based Model for Early Childhood Caries Detection in Dental Photographs.,Journal of clinical medicine,2024 Sep 3,"Background/Objectives: Early childhood caries (ECC) is a widespread and severe oral health problem that potentially affects the general health of children. Visual-tactile examination remains the diagnostic method of choice to diagnose ECC, although visual examination could be automated by artificial intelligence (AI) tools in the future. The aim of this study was the external validation of a recently published and freely accessible AI-based model for detecting ECC and classifying carious lesions in dental photographs. Methods: A total of 143 anonymised photographs of anterior deciduous teeth (ECC = 107, controls = 36) were visually evaluated by the dental study group (reference test) and analysed using the AI-based model (test method). Diagnostic performance was determined statistically. Results: ECC detection accuracy was 97.2%. Diagnostic performance varied between carious lesion classes (noncavitated lesions, greyish translucency/microcavity, cavitation, destructed tooth), with accuracies ranging from 88.9% to 98.1%, sensitivities ranging from 68.8% to 98.5% and specificities ranging from 86.1% to 99.4%. The area under the curve ranged from 0.834 to 0.964. Conclusions: The performance of the AI-based model is similar to that reported for the internal dataset used by developers. Further studies with independent image samples are required to comprehensively gauge the performance of the model.",https://doi.org/10.3390/jcm13175215
39272733,"['Hao, Jing', 'Wong, Lun M', 'Shan, Zhiyi', 'Ai, Qi Yong H', 'Shi, Xieqi', 'Tsoi, James Kit Hon', 'Hung, Kuo Feng']",A Semi-Supervised Transformer-Based Deep Learning Framework for Automated Tooth Segmentation and Identification on Panoramic Radiographs.,"Diagnostics (Basel, Switzerland)",2024 Sep 3,"Automated tooth segmentation and identification on dental radiographs are crucial steps in establishing digital dental workflows. While deep learning networks have been developed for these tasks, their performance has been inferior in partially edentulous individuals. This study proposes a novel semi-supervised Transformer-based framework (SemiTNet), specifically designed to improve tooth segmentation and identification performance on panoramic radiographs, particularly in partially edentulous cases, and establish an open-source dataset to serve as a unified benchmark. A total of 16,317 panoramic radiographs (1589 labeled and 14,728 unlabeled images) were collected from various datasets to create a large-scale dataset (TSI15k). The labeled images were divided into training and test sets at a 7:1 ratio, while the unlabeled images were used for semi-supervised learning. The SemiTNet was developed using a semi-supervised learning method with a label-guided teacher-student knowledge distillation strategy, incorporating a Transformer-based architecture. The performance of SemiTNet was evaluated on the test set using the intersection over union (IoU), Dice coefficient, precision, recall, and F1 score, and compared with five state-of-the-art networks. Paired t-tests were performed to compare the evaluation metrics between SemiTNet and the other networks. SemiTNet outperformed other networks, achieving the highest accuracy for tooth segmentation and identification, while requiring minimal model size. SemiTNet's performance was near-perfect for fully dentate individuals (all metrics over 99.69%) and excellent for partially edentulous individuals (all metrics over 93%). In edentulous cases, SemiTNet obtained statistically significantly higher tooth identification performance than all other networks. The proposed SemiTNet outperformed previous high-complexity, state-of-the-art networks, particularly in partially edentulous cases. The established open-source TSI15k dataset could serve as a unified benchmark for future studies.",https://doi.org/10.3390/diagnostics14171948
39266401,"['Lu, Wei', 'Yu, Xueqian', 'Li, Yueyang', 'Cao, Yi', 'Chen, Yanning', 'Hua, Fang']",Artificial Intelligence-Related Dental Research: Bibliometric and Altmetric Analysis.,International dental journal,2024 Sep 11,"BACKGROUND: Recent years have witnessed an explosive surge in dental research related to artificial intelligence (AI). These applications have optimised dental workflows, demonstrating significant clinical importance. Understanding the current landscape and trends of this topic is crucial for both clinicians and researchers to utilise and advance this technology. However, a comprehensive scientometric study regarding this field had yet to be performed. METHODS: A literature search was conducted in the Web of Science Core Collection database to identify eligible ""research articles"" and ""reviews."" Literature screening and exclusion were performed by 2 investigators. Thereafter, VOSviewer was utilised in co-occurrence analysis and CiteSpace in co-citation analysis. R package Bibliometrix was employed to automatically calculate scientific impacts, determining the core authors and journals. Altmetric data were described narratively and supplemented with Spearman correlation analysis. RESULTS: A total of 1558 research publications were included. During the past 5 years, AI-related dental publications drastically increased in number, from 36 to 581. Diagnostics and Scientific Reports published the most articles, whereas Journal of Dental Research received the highest number of citations per article. China, the US, and South Korea emerged as the most prolific countries, whilst Germany received the highest number of citations per article (23.29). Charité Universitätsmedizin Berlin was the institution with the highest number of publications and citations per article (29.16). Altmetric Attention Score was correlated with News Mentions (P < .001), and significant associations were observed amongst Dimension Citations, Mendeley Readers, and Web of Science Citations (P < .001). CONCLUSIONS: The publication numbers regarding AI-related dental research have been rising rapidly and may continue their upwards trend. China, the US, South Korea, and Germany had promoted the progress of AI-related dental research. Disease diagnosis, orthodontic applications, and morphology segmentation were current hotspots. Attention mechanism, explainable AI, multimodal data fusion, and AI-generated text assistants necessitate future research and exploration.",https://doi.org/10.1016/j.identj.2024.08.004
39254786,"['Veseli, E']",Artificial intelligence progress in the diagnosis of oral mucosal lesions: implications for pediatric dental health.,European archives of paediatric dentistry : official journal of the European Academy of Paediatric Dentistry,2024 Sep 10,,https://doi.org/10.1007/s40368-024-00944-0
39245622,"['Dashti, Mahmood', 'Ghasemi, Shohreh', 'Khurshid, Zohaib']",Integrating Artificial Intelligence in Dental Education: An Urgent Call for Dedicated Postgraduate Programs.,International dental journal,2024 Sep 7,,https://doi.org/10.1016/j.identj.2024.08.008
39242442,"['Li, Zheng', 'Li, Zhongqiang', 'Zhang, Ya', 'Wang, Huaizhi', 'Li, Xin', 'Zhang, Jian', 'Zaid, Waleed', 'Yao, Shaomian', 'Xu, Jian']",Human Tooth Crack Image Analysis with Multiple Deep Learning Approaches.,Annals of biomedical engineering,2024 Sep 6,"Tooth cracks, one of the most common dental diseases, can result in the tooth falling apart without prompt treatment; dentists also have difficulty locating cracks, even with X-ray imaging. Indocyanine green (ICG) assisted near-infrared fluorescence (NIRF) dental imaging technique can solve this problem due to the deep penetration of NIR light and the excellent fluorescence characteristics of ICG. This study extracted 593 human cracked tooth images and 601 non-cracked tooth images from NIR imaging videos. Multiple imaging analysis methods such as classification, object detection, and super-resolution were applied to the dataset for cracked image analysis. Our results showed that machine learning methods could help analyze tooth crack efficiently: the tooth images with cracks and without cracks could be well classified with the pre-trained residual network and squeezenet1_1 models, with a classification accuracy of 88.2% and 94.25%, respectively; the single shot multi-box detector (SSD) was able to recognize cracks, even if the input image was at a different size from the original cracked image; the super-resolution (SR) model, SR-generative adversarial network demonstrated enhanced resolution of crack images using high-resolution concrete crack images as the training dataset. Overall, deep learning model-assisted human crack analysis improves crack identification; the combination of our NIR dental imaging system and deep learning models has the potential to assist dentists in crack diagnosis.",https://doi.org/10.1007/s10439-024-03615-9
39242274,"['Farook, Taseef Hasan', 'Ramees, Lameesa', 'Dudley, James']","Relationship between anterior occlusion, arch dimension, and mandibular movement during speech articulation: A three-dimensional analysis.",The Journal of prosthetic dentistry,2024 Sep 5,"STATEMENT OF PROBLEM: Studies correlating occlusal morphology from 3-dimensional intraoral scans with both soft and hard tissue dynamic landmark tracking within the same participant population are lacking. PURPOSE: The purpose of this clinical study was to use 3-dimensional intraoral scanning, computer-aided design, electrognathography, and artificial intelligence to investigate the relationships between anterior occlusion and arch parameters with hard and soft tissue displacements during speech production. MATERIAL AND METHODS: An artificial intelligence (AI) driven software program and electrognathography was used to record the phonetic activities in 62 participants for soft tissue (ST) and hard tissue (HT) displacement. Soft tissue displacement was quantified by the mean difference between subnasale and soft tissue pogonion peaks during phonetic expressions, and hard tissue displacement was directly measured with an electrognathograph. Intercanine and intermolar distances, arch perimeters, and horizontal and vertical overlap were measured from the intraoral scan data. RESULTS: ST and HT displacements were successfully estimated for fricative (ST=7.16 ±4.51 mm, HT=11.86 ±4.02 mm), sibilant (ST=5.11 ±3.49 mm, HT=8.24 ±3.31 mm), linguodental (ST=5.72 ±4.46 mm, HT=10.01 ±3.16 mm), and bilabial (ST=5.56 ±4.64 mm, HT=11.69 ±4.28 mm) phonetics. Vertical overlap correlated positively with hard tissue movement during all speech expressions except bilabial phonetics (ρ=.30 to.41, P<.05). Maxillary and mandibular arch perimeters showed negative correlations with soft tissue displacement during linguodental and bilabial speech (ρ=-.25 to -.41, P<.05) but were significantly correlated with hard tissue movement during all speech assessments (ρ=-.28 to -.44, P<.05). Maxillary intermolar distances negatively correlated with hard tissue phonetic expressions (ρ=-.24 to -.30, P<.05). Participant age positively correlated with soft tissue displacement during all speech patterns (ρ=.28 to.33, P<.05) and with weight increase (ρ=.27, P=.033), and hard tissue displacement (ρ=.25, P=.048) during maximum mouth opening significantly correlated with linguodental phonetics. CONCLUSIONS: Within the study population, vertical overlap, maxillary intermolar distance, and dental arch perimeters correlated significantly with mandibular displacement during phonetic expression.",https://doi.org/10.1016/j.prosdent.2024.08.001
39241044,"['Kang, Sohee', 'Shon, Byungeun', 'Park, Eun Young', 'Jeong, Sungmoon', 'Kim, Eun-Kyong']",Diagnostic accuracy of dental caries detection using ensemble techniques in deep learning with intraoral camera images.,PloS one,2024,"Camera image-based deep learning (DL) techniques have achieved promising results in dental caries screening. To apply the intraoral camera image-based DL technique for dental caries detection and assess its diagnostic performance, we employed the ensemble technique in the image classification task. 2,682 intraoral camera images were used as the dataset for image classification according to dental caries presence and caries-lesion localization using DL models such as ResNet-50, Inception-v3, Inception-ResNet-v2, and Faster R-convolutional neural network according to diagnostic study design. 534 participants whose mean age [SD] was 47.67 [±13.94] years were enrolled. The dataset was divided into training (56.0%), validation (14.0%), and test subset (30.0%) annotated by one experienced dentist as a reference standard about dental caries detection and lesion location. The confusion matrix, area under the receiver operating characteristic curve (AUROC), and average precision (AP) were evaluated for performance analysis. In the end-to-end dental caries image classification, the ensemble DL models had consistently improved performance, in which as the best results, the ensemble model of Inception-ResNet-v2 achieved 0.94 of AUROC and 0.97 of AP. On the other hand, the explainable model achieved 0.91 of AUROC and 0.96 of AP after the ensemble application. For dental caries classification using intraoral camera images, the application of ensemble techniques exhibited consistently improved performance regardless of the DL models. Furthermore, the trial to create an explainable DL model based on carious lesion detection yielded favorable results.",https://doi.org/10.1371/journal.pone.0310004
39232939,"['Talib, Manar Abu', 'Moufti, Mohammad Adel', 'Nasir, Qassim', 'Kabbani, Yousuf', 'Aljaghber, Dana', 'Afadar, Yaman']",Transfer Learning-Based Classifier to Automate the Extraction of False X-Ray Images From Hospital's Database.,International dental journal,2024 Sep 3,"BACKGROUND: During preclinical training, dental students take radiographs of acrylic (plastic) blocks containing extracted patient teeth. With the digitisation of medical records, a central archiving system was created to store and retrieve all x-ray images, regardless of whether they were images of teeth on acrylic blocks, or those from patients. In the early stage of the digitisation process, and due to the immaturity of the data management system, numerous images were mixed up and stored in random locations within a unified archiving system, including patient record files. Filtering out and expunging the undesired training images is imperative as manual searching for such images is problematic. Hence the aim of this stidy was to differentiate intraoral images from artificial images on acrylic blocks. METHODS: An artificial intelligence (AI) solution to automatically differentiate between intraoral radiographs taken of patients and those taken of acrylic blocks was utilised in this study. The concept of transfer learning was applied to a dataset provided by a Dental Hospital. RESULTS: An accuracy score, F1 score, and a recall score of 98.8%, 99.2%, and 100%, respectively, were achieved using a VGG16 pre-trained model. These results were more sensitive compared to those obtained initally using a baseline model with 96.5%, 97.5%, and 98.9% accuracy score, F1 score, and a recall score respectively. CONCLUSIONS: The proposed system using transfer learning was able to accurately identify ""fake"" radiographs images and distinguish them from the real intraoral images.",https://doi.org/10.1016/j.identj.2024.08.002
39230022,"['Cho, Sung Joo', 'Moon, Jun-Ho', 'Ko, Dong-Yub', 'Lee, Ju-Myung', 'Park, Ji-Ae', 'Donatelli, Richard E', 'Lee, Shin-Jae']",Orthodontic treatment outcome predictive performance differences between artificial intelligence and conventional methods.,The Angle orthodontist,2024 Sep 1,"OBJECTIVES: To evaluate an artificial intelligence (AI) model in predicting soft tissue and alveolar bone changes following orthodontic treatment and compare the predictive performance of the AI model with conventional prediction models. MATERIALS AND METHODS: A total of 1774 lateral cephalograms of 887 adult patients who had undergone orthodontic treatment were collected. Patients who had orthognathic surgery were excluded. On each cephalogram, 78 landmarks were detected using PIPNet-based AI. Prediction models consisted of 132 predictor variables and 88 outcome variables. Predictor variables were demographics (age, sex), clinical (treatment time, premolar extraction), and Cartesian coordinates of the 64 anatomic landmarks. Outcome variables were Cartesian coordinates of the 22 soft tissue and 22 hard tissue landmarks after orthodontic treatment. The AI prediction model was based on the TabNet deep neural network. Two conventional statistical methods, multivariate multiple linear regression (MMLR) and partial least squares regression (PLSR), were each implemented for comparison. Prediction accuracy among the methods was compared. RESULTS: Overall, MMLR demonstrated the most accurate results, while AI was least accurate. AI showed superior predictions in only 5 of the 44 anatomic landmarks, all of which were soft tissue landmarks inferior to menton to the terminal point of the neck. CONCLUSIONS: When predicting changes following orthodontic treatment, AI was not as effective as conventional statistical methods. However, AI had an outstanding advantage in predicting soft tissue landmarks with substantial variability. Overall, results may indicate the need for a hybrid prediction model that combines conventional and AI methods.",https://doi.org/10.2319/111823-767.1
39230019,"['Park, Ji-Ae', 'Moon, Jun-Ho', 'Lee, Ju-Myung', 'Cho, Sung Joo', 'Seo, Byoung-Moo', 'Donatelli, Richard E', 'Lee, Shin-Jae']",Does artificial intelligence predict orthognathic surgical outcomes better than conventional linear regression methods?,The Angle orthodontist,2024 Sep 1,"OBJECTIVES: To evaluate the performance of an artificial intelligence (AI) model in predicting orthognathic surgical outcomes compared to conventional prediction methods. MATERIALS AND METHODS: Preoperative and posttreatment lateral cephalograms from 705 patients who underwent combined surgical-orthodontic treatment were collected. Predictors included 254 input variables, including preoperative skeletal and soft-tissue characteristics, as well as the extent of orthognathic surgical repositioning. Outcomes were 64 Cartesian coordinate variables of 32 soft-tissue landmarks after surgery. Conventional prediction models were built applying two linear regression methods: multivariate multiple linear regression (MLR) and multivariate partial least squares algorithm (PLS). The AI-based prediction model was based on the TabNet deep neural network. The prediction accuracy was compared, and the influencing factors were analyzed. RESULTS: In general, MLR demonstrated the poorest predictive performance. Among 32 soft-tissue landmarks, PLS showed more accurate prediction results in 16 soft-tissue landmarks above the upper lip, whereas AI outperformed in six landmarks located in the lower border of the mandible and neck area. The remaining 10 landmarks presented no significant difference between AI and PLS prediction models. CONCLUSIONS: AI predictions did not always outperform conventional methods. A combination of both methods may be more effective in predicting orthognathic surgical outcomes.",https://doi.org/10.2319/111423-756.1
39227811,"['Quah, Bernadette', 'Zheng, Lei', 'Sng, Timothy Jie Han', 'Yong, Chee Weng', 'Islam, Intekhab']",Reliability of ChatGPT in automated essay scoring for dental undergraduate examinations.,BMC medical education,2024 Sep 3,"BACKGROUND: This study aimed to answer the research question: How reliable is ChatGPT in automated essay scoring (AES) for oral and maxillofacial surgery (OMS) examinations for dental undergraduate students compared to human assessors? METHODS: Sixty-nine undergraduate dental students participated in a closed-book examination comprising two essays at the National University of Singapore. Using pre-created assessment rubrics, three assessors independently performed manual essay scoring, while one separate assessor performed AES using ChatGPT (GPT-4). Data analyses were performed using the intraclass correlation coefficient and Cronbach's α to evaluate the reliability and inter-rater agreement of the test scores among all assessors. The mean scores of manual versus automated scoring were evaluated for similarity and correlations. RESULTS: A strong correlation was observed for Question 1 (r = 0.752-0.848, p < 0.001) and a moderate correlation was observed between AES and all manual scorers for Question 2 (r = 0.527-0.571, p < 0.001). Intraclass correlation coefficients of 0.794-0.858 indicated excellent inter-rater agreement, and Cronbach's α of 0.881-0.932 indicated high reliability. For Question 1, the mean AES scores were similar to those for manual scoring (p > 0.05), and there was a strong correlation between AES and manual scores (r = 0.829, p < 0.001). For Question 2, AES scores were significantly lower than manual scores (p < 0.001), and there was a moderate correlation between AES and manual scores (r = 0.599, p < 0.001). CONCLUSION: This study shows the potential of ChatGPT for essay marking. However, an appropriate rubric design is essential for optimal reliability. With further validation, the ChatGPT has the potential to aid students in self-assessment or large-scale marking automated processes.",https://doi.org/10.1186/s12909-024-05881-6
39227802,"['Kurt, Ayça', 'Günaçar, Dilara Nil', 'Şılbır, Fatma Yanık', 'Yeşil, Zeynep', 'Bayrakdar, İbrahim Şevki', 'Çelik, Özer', 'Bilgir, Elif', 'Orhan, Kaan']",Evaluation of tooth development stages with deep learning-based artificial intelligence algorithm.,BMC oral health,2024 Sep 3,"BACKGROUND: This study aims to evaluate the performance of a deep learning system for the evaluation of tooth development stages on images obtained from panoramic radiographs from child patients. METHODS: The study collected a total of 1500 images obtained from panoramic radiographs from child patients between the ages of 5 and 14 years. YOLOv5, a convolutional neural network (CNN)-based object detection model, was used to automatically detect the calcification states of teeth. Images obtained from panoramic radiographs from child patients were trained and tested in the YOLOv5 algorithm. True-positive (TP), false-positive (FP), and false-negative (FN) ratios were calculated. A confusion matrix was used to evaluate the performance of the model. RESULTS: Among the 146 test group images with 1022 labels, there were 828 TPs, 308 FPs, and 1 FN. The sensitivity, precision, and F1-score values of the detection model of the tooth stage development model were 0.99, 0.72, and 0.84, respectively. CONCLUSIONS: In conclusion, utilizing a deep learning-based approach for the detection of dental development on pediatric panoramic radiographs may facilitate a precise evaluation of the chronological correlation between tooth development stages and age. This can help clinicians make treatment decisions and aid dentists in finding more accurate treatment options.",https://doi.org/10.1186/s12903-024-04786-6
